{
  "id": "GPL-2.0-with-classpath-exception",
  "kind": "license",
  "schemaVersion": "1.0.0",
  "sourceFingerprint": {
    "sourceId": "spdx-license-list",
    "revision": "manifest-sha256:74897699de0d23c4da42b94bf46bc6fd01f7b68ffcece9db1a98194ac277bb02",
    "contentHash": "sha256:c3b1b756e66a79f2a701bb1f3a1330fb0e7722a052e267afc71f786aeac9cbd5"
  },
  "review": {
    "status": "not-recommendable",
    "recommendable": false,
    "evidenceLevel": "strong"
  },
  "semantic": {
    "family": "weak-copyleft",
    "copyleftScope": "library",
    "permissions": [
      "conditional-relicensing",
      "distribution",
      "modifications",
      "unknown"
    ],
    "obligations": [
      "preserve-combined-license-terms",
      "unknown"
    ],
    "triggers": [
      "combination",
      "distribution",
      "linking",
      "modification"
    ],
    "restrictions": [
      "additional-terms",
      "unknown"
    ],
    "patentPosition": "unknown",
    "noticeBurden": "unknown"
  },
  "evidence": [
    {
      "field": "family",
      "sourceId": "spdx-license-list",
      "locator": "public/data/licenses/GPL-2.0-with-classpath-exception.json#text; Classpath výjimka zužuje dopad na knihovnu u nezávislých linkovaných modulů; nejde o automatické GPL celého executable. Základní GPL text je placeholder.",
      "ruleId": "guide-expansion.editorial-review",
      "ruleVersion": "2026-09-09.10"
    },
    {
      "field": "copyleftScope",
      "sourceId": "spdx-license-list",
      "locator": "public/data/licenses/GPL-2.0-with-classpath-exception.json#text; Classpath výjimka zužuje dopad na knihovnu u nezávislých linkovaných modulů; nejde o automatické GPL celého executable. Základní GPL text je placeholder.",
      "ruleId": "guide-expansion.editorial-review",
      "ruleVersion": "2026-09-09.10"
    },
    {
      "field": "permissions",
      "sourceId": "spdx-license-list",
      "locator": "public/data/licenses/GPL-2.0-with-classpath-exception.json#text; Výjimka dovoluje statické/dynamické linkování nezávislých modulů a distribuci executable pod zvolenými podmínkami při splnění jejich licencí. Plný základní grant GPL a patentové postavení nelze z placeholderu doložit.",
      "ruleId": "guide-expansion.editorial-review",
      "ruleVersion": "2026-09-09.10"
    },
    {
      "field": "obligations",
      "sourceId": "spdx-license-list",
      "locator": "public/data/licenses/GPL-2.0-with-classpath-exception.json#text; Classpath výjimka zachovává podmínky licencí každého nezávislého modulu. Při změně knihovny lze výjimku rozšířit na svou verzi nebo ji vymazat; úplné GPL povinnosti jsou odkazem na chybějící text.",
      "ruleId": "guide-expansion.editorial-review",
      "ruleVersion": "2026-09-09.10"
    },
    {
      "field": "triggers",
      "sourceId": "spdx-license-list",
      "locator": "public/data/licenses/GPL-2.0-with-classpath-exception.json#text; Classpath výjimka zachovává podmínky licencí každého nezávislého modulu. Při změně knihovny lze výjimku rozšířit na svou verzi nebo ji vymazat; úplné GPL povinnosti jsou odkazem na chybějící text.",
      "ruleId": "guide-expansion.editorial-review",
      "ruleVersion": "2026-09-09.10"
    },
    {
      "field": "restrictions",
      "sourceId": "spdx-license-list",
      "locator": "public/data/licenses/GPL-2.0-with-classpath-exception.json#text; První věta označuje kombinaci jako GPL celek a další odstavec z toho vyjímá nezávislé moduly; výjimka neplatí pro moduly odvozené z knihovny. Záruky a terminace základu v textu nejsou přítomny.",
      "ruleId": "guide-expansion.editorial-review",
      "ruleVersion": "2026-09-09.10"
    },
    {
      "field": "patentPosition",
      "sourceId": "spdx-license-list",
      "locator": "public/data/licenses/GPL-2.0-with-classpath-exception.json#text; Výjimka dovoluje statické/dynamické linkování nezávislých modulů a distribuci executable pod zvolenými podmínkami při splnění jejich licencí. Plný základní grant GPL a patentové postavení nelze z placeholderu doložit.",
      "ruleId": "guide-expansion.editorial-review",
      "ruleVersion": "2026-09-09.10"
    },
    {
      "field": "noticeBurden",
      "sourceId": "spdx-license-list",
      "locator": "public/data/licenses/GPL-2.0-with-classpath-exception.json#text; Classpath výjimka zachovává podmínky licencí každého nezávislého modulu. Při změně knihovny lze výjimku rozšířit na svou verzi nebo ji vymazat; úplné GPL povinnosti jsou odkazem na chybějící text.",
      "ruleId": "guide-expansion.editorial-review",
      "ruleVersion": "2026-09-09.10"
    },
    {
      "field": "review",
      "sourceId": "spdx-license-list",
      "locator": "public/data/licenses/GPL-2.0-with-classpath-exception.json#text; Individuálně přečten celý připnutý text. Text se vztahuje na knihovnu, nezávislé moduly a vzniklý executable; vlastní základní GPLv2 v připnutém textu chybí. Historický identifikátor obsahuje Classpath výjimku pro linkování nezávislých modulů pod vlastními podmínkami, ale místo GPLv2 má pouze zástupnou větu. Úpravy knihovny mohou výjimku zachovat nebo odstranit. Připnutý text začíná insert GPL v2 license text here; chybí grant a povinnosti základní licence. Doplnit ověřenou vazbu na skutečný GPLv2 grant a vyjádřit s výjimkou přes WITH; tento deprecated identifikátor se nesmí doporučovat novému projektu.",
      "ruleId": "guide-expansion.editorial-review",
      "ruleVersion": "2026-09-09.10"
    }
  ]
}
