{
  "id": "NCSA",
  "kind": "license",
  "schemaVersion": "1.0.0",
  "sourceFingerprint": {
    "sourceId": "spdx-license-list",
    "revision": "manifest-sha256:74897699de0d23c4da42b94bf46bc6fd01f7b68ffcece9db1a98194ac277bb02",
    "contentHash": "sha256:2dbef3cb345a2b9ea067f4c5015f8cbef56da36c608b5ada52d45a84997f0496"
  },
  "review": {
    "status": "reviewed",
    "recommendable": true,
    "evidenceLevel": "strong"
  },
  "semantic": {
    "family": "permissive",
    "copyleftScope": "none",
    "permissions": [
      "commercial-use",
      "distribution",
      "modifications",
      "private-use",
      "sublicensing"
    ],
    "obligations": [
      "include-copyright",
      "include-license-text"
    ],
    "triggers": [
      "distribution"
    ],
    "restrictions": [
      "liability",
      "trademark",
      "warranty"
    ],
    "patentPosition": "none-stated",
    "noticeBurden": "standard"
  },
  "evidence": [
    {
      "field": "copyleftScope",
      "sourceId": "spdx-license-list",
      "locator": "public/data/licenses/NCSA.json#text; unrestricted permission paragraph, including sublicense and sell; whole text: no reciprocal source-disclosure or same-license requirement; https://spdx.org/licenses/NCSA.html",
      "ruleId": "guide-expansion.editorial-review",
      "ruleVersion": "2026-09-09"
    },
    {
      "field": "family",
      "sourceId": "spdx-license-list",
      "locator": "public/data/licenses/NCSA.json#text; unrestricted permission paragraph, including sublicense and sell; https://spdx.org/licenses/NCSA.html",
      "ruleId": "guide-expansion.editorial-review",
      "ruleVersion": "2026-09-09"
    },
    {
      "field": "noticeBurden",
      "sourceId": "spdx-license-list",
      "locator": "public/data/licenses/NCSA.json#text; first and second bullet: notices, conditions and disclaimers in source redistributions or accompanying binary materials; no obligation to supply source; https://spdx.org/licenses/NCSA.html",
      "ruleId": "guide-expansion.editorial-review",
      "ruleVersion": "2026-09-09"
    },
    {
      "field": "obligations",
      "sourceId": "spdx-license-list",
      "locator": "public/data/licenses/NCSA.json#text; first and second bullet: notices, conditions and disclaimers in source redistributions or accompanying binary materials; no obligation to supply source; https://spdx.org/licenses/NCSA.html",
      "ruleId": "guide-expansion.editorial-review",
      "ruleVersion": "2026-09-09"
    },
    {
      "field": "patentPosition",
      "sourceId": "spdx-license-list",
      "locator": "public/data/licenses/NCSA.json#text; whole text: no express patent grant or patent-litigation termination clause is stated; this is not a conclusion about implied rights; https://spdx.org/licenses/NCSA.html",
      "ruleId": "guide-expansion.editorial-review",
      "ruleVersion": "2026-09-09"
    },
    {
      "field": "permissions",
      "sourceId": "spdx-license-list",
      "locator": "public/data/licenses/NCSA.json#text; unrestricted permission paragraph, including sublicense and sell; https://spdx.org/licenses/NCSA.html",
      "ruleId": "guide-expansion.editorial-review",
      "ruleVersion": "2026-09-09"
    },
    {
      "field": "restrictions",
      "sourceId": "spdx-license-list",
      "locator": "public/data/licenses/NCSA.json#text; third bullet: no endorsement using institution/contributor names; final warranty and liability disclaimer; https://spdx.org/licenses/NCSA.html",
      "ruleId": "guide-expansion.editorial-review",
      "ruleVersion": "2026-09-09"
    },
    {
      "field": "review",
      "sourceId": "spdx-license-list",
      "locator": "public/data/licenses/NCSA.json#text; whole-text editorial review on 2026-09-09; Zachovejte copyright, podmínky a disclaimer ve zdrojích nebo materiálech k binární distribuci. Jména autorů a institucí nelze bez souhlasu použít k propagaci. Poskytnutí zdrojového kódu není podmínkou.; https://spdx.org/licenses/NCSA.html",
      "ruleId": "guide-expansion.editorial-review",
      "ruleVersion": "2026-09-09"
    },
    {
      "field": "triggers",
      "sourceId": "spdx-license-list",
      "locator": "public/data/licenses/NCSA.json#text; first and second bullet: notices, conditions and disclaimers in source redistributions or accompanying binary materials; no obligation to supply source; https://spdx.org/licenses/NCSA.html",
      "ruleId": "guide-expansion.editorial-review",
      "ruleVersion": "2026-09-09"
    }
  ]
}
