{
  "id": "gtkbook",
  "kind": "license",
  "schemaVersion": "1.0.0",
  "sourceFingerprint": {
    "sourceId": "spdx-license-list",
    "revision": "manifest-sha256:74897699de0d23c4da42b94bf46bc6fd01f7b68ffcece9db1a98194ac277bb02",
    "contentHash": "sha256:84e1cd4d1c9522e6c6cfee5346e018cecf5d41810521471e08e2126f44a213c0"
  },
  "review": {
    "status": "reviewed",
    "recommendable": true,
    "evidenceLevel": "strong"
  },
  "semantic": {
    "family": "permissive",
    "copyleftScope": "none",
    "permissions": [
      "commercial-use",
      "distribution",
      "modifications",
      "private-use"
    ],
    "obligations": [
      "include-copyright"
    ],
    "triggers": [
      "distribution"
    ],
    "restrictions": [
      "warranty"
    ],
    "patentPosition": "none-stated",
    "noticeBurden": "minimal"
  },
  "evidence": [
    {
      "field": "family",
      "sourceId": "spdx-license-list",
      "locator": "public/data/licenses/gtkbook.json#text; Libovolný účel a podmíněné uchování copyrightu pouze u původní podoby nezavádějí copyleft; permisivní licence.",
      "ruleId": "guide-expansion.editorial-review",
      "ruleVersion": "2026-09-09.10"
    },
    {
      "field": "copyleftScope",
      "sourceId": "spdx-license-list",
      "locator": "public/data/licenses/gtkbook.json#text; Libovolný účel a podmíněné uchování copyrightu pouze u původní podoby nezavádějí copyleft; permisivní licence.",
      "ruleId": "guide-expansion.editorial-review",
      "ruleVersion": "2026-09-09.10"
    },
    {
      "field": "permissions",
      "sourceId": "spdx-license-list",
      "locator": "public/data/licenses/gtkbook.json#text; Free to use this code for any purpose dává neomezené účelové užití; distribuce je výslovně předpokládána. Patentový grant a samostatná sublicence chybějí.",
      "ruleId": "guide-expansion.editorial-review",
      "ruleVersion": "2026-09-09.10"
    },
    {
      "field": "obligations",
      "sourceId": "spdx-license-list",
      "locator": "public/data/licenses/gtkbook.json#text; If republished or redistributed in its original form omezuje povinný copyright na šíření původní podoby, v tištěné i elektronické formě. Nejde o bezpodmínečnou povinnost všech modifikovaných verzí; zdroje ani stejná licence se nevyžadují.",
      "ruleId": "guide-expansion.editorial-review",
      "ruleVersion": "2026-09-09.10"
    },
    {
      "field": "triggers",
      "sourceId": "spdx-license-list",
      "locator": "public/data/licenses/gtkbook.json#text; If republished or redistributed in its original form omezuje povinný copyright na šíření původní podoby, v tištěné i elektronické formě. Nejde o bezpodmínečnou povinnost všech modifikovaných verzí; zdroje ani stejná licence se nevyžadují.",
      "ruleId": "guide-expansion.editorial-review",
      "ruleVersion": "2026-09-09.10"
    },
    {
      "field": "restrictions",
      "sourceId": "spdx-license-list",
      "locator": "public/data/licenses/gtkbook.json#text; Věta This code is distributed without warranty odmítá záruku; celý text neobsahuje samostatnou odpovědnostní či známkovou doložku.",
      "ruleId": "guide-expansion.editorial-review",
      "ruleVersion": "2026-09-09.10"
    },
    {
      "field": "patentPosition",
      "sourceId": "spdx-license-list",
      "locator": "public/data/licenses/gtkbook.json#text; Free to use this code for any purpose dává neomezené účelové užití; distribuce je výslovně předpokládána. Patentový grant a samostatná sublicence chybějí.",
      "ruleId": "guide-expansion.editorial-review",
      "ruleVersion": "2026-09-09.10"
    },
    {
      "field": "noticeBurden",
      "sourceId": "spdx-license-list",
      "locator": "public/data/licenses/gtkbook.json#text; If republished or redistributed in its original form omezuje povinný copyright na šíření původní podoby, v tištěné i elektronické formě. Nejde o bezpodmínečnou povinnost všech modifikovaných verzí; zdroje ani stejná licence se nevyžadují.",
      "ruleId": "guide-expansion.editorial-review",
      "ruleVersion": "2026-09-09.10"
    },
    {
      "field": "review",
      "sourceId": "spdx-license-list",
      "locator": "public/data/licenses/gtkbook.json#text; Individuálně přečten celý připnutý text. Grant se týká kódu s copyrightem Syda Logana 2005, nikoli automaticky celé knihy. Kód lze užít pro jakýkoli účel bez záruky. Copyright musí doprovázet pouze opětovné publikování nebo šíření kódu v původní podobě, papírově i elektronicky. ",
      "ruleId": "guide-expansion.editorial-review",
      "ruleVersion": "2026-09-09.10"
    }
  ]
}
