{
  "id": "APSL-1.0",
  "kind": "license",
  "schemaVersion": "1.0.0",
  "sourceFingerprint": {
    "sourceId": "spdx-license-list",
    "revision": "manifest-sha256:74897699de0d23c4da42b94bf46bc6fd01f7b68ffcece9db1a98194ac277bb02",
    "contentHash": "sha256:936959a9913aed337ea481141402f765a8339ea81bc0461ffd842792ffdc349e"
  },
  "review": {
    "status": "not-recommendable",
    "recommendable": false,
    "evidenceLevel": "strong"
  },
  "semantic": {
    "family": "weak-copyleft",
    "copyleftScope": "file",
    "permissions": [
      "commercial-use",
      "conditional-relicensing",
      "distribution",
      "modifications",
      "patent-grant",
      "private-use",
      "sublicensing"
    ],
    "obligations": [
      "defend-added-warranty",
      "disclose-source",
      "include-copyright",
      "include-license-text",
      "include-notice",
      "mark-modifications",
      "same-license",
      "unknown"
    ],
    "triggers": [
      "combination",
      "distribution",
      "modification",
      "patent-claim",
      "unknown",
      "use"
    ],
    "restrictions": [
      "additional-terms",
      "liability",
      "patent-claim",
      "trademark",
      "unknown",
      "warranty"
    ],
    "patentPosition": "retaliatory-termination",
    "noticeBurden": "material"
  },
  "evidence": [
    {
      "field": "family",
      "sourceId": "spdx-license-list",
      "locator": "APSL 1.0 §§1.2,1.5,2.2(b),4: stejná licence pro zdroje Covered Code a jeho změn s oddělením cizího kódu Larger Work. Slabý copyleft; nasazení mimo R&D zahrnuje širší interní užití, nikoli pouze síťový provoz.",
      "ruleId": "guide-expansion.editorial-review",
      "ruleVersion": "2026-09-09.10"
    },
    {
      "field": "copyleftScope",
      "sourceId": "spdx-license-list",
      "locator": "APSL 1.0 §1.5 výslovně při souborovém vydání pokrývá změněné soubory i nové soubory obsahující část kódu. §4 ponechává ostatní kód Larger Work mimo tuto reciprocitu. Známá souborová hranice, nikoli knihovní či celodílový odhad.",
      "ruleId": "guide-expansion.editorial-review",
      "ruleVersion": "2026-09-09.10"
    },
    {
      "field": "permissions",
      "sourceId": "spdx-license-list",
      "locator": "APSL 1.0 §2 autorské a Applicable Patents granty, §2.1 use/copy/modify/distribute pro R&D, §2.2 Deploy dle §1.3 včetně podlicencí a provozu. §3 vzájemná a širší Apple práva, §6 placené další závazky; §7 podmíněná volba pozdější Apple verze, ne obecné přelicencování.",
      "ruleId": "guide-expansion.editorial-review",
      "ruleVersion": "2026-09-09.10"
    },
    {
      "field": "obligations",
      "sourceId": "spdx-license-list",
      "locator": "APSL 1.0 §2.1 notices/licence, datované přesné změny s původní verzí a Exhibit A v každém změněném zdrojovém souboru; §2.2 veřejné elektronické zdroje nasazených změn nejméně 12 měsíců či po dobu nasazení, hlášení formulářem a binární informace o zdroji. §6 defense/indemnity za vlastní závazky je známá. Unknown zachovává aktivní hlášení, širší Apple grant §3(b), aktivní souhlas §6 a ničení kopií §12.2/13.6(b).",
      "ruleId": "guide-expansion.editorial-review",
      "ruleVersion": "2026-09-09.10"
    },
    {
      "field": "triggers",
      "sourceId": "spdx-license-list",
      "locator": "APSL 1.0 §1.3 a §2.2 Deploy zahrnuje použití mimo R&D i uvnitř firmy, distribuci a podlicence; §2.1 změny a kopie, §4 kombinaci a §12.1(c) patentovou žalobu. Use je známé, síť není samostatný výlučný spouštěč. Unknown označuje zvláštní stavové ukončení účinné zveřejněním na Apple webu v §9.1 a zákonnou překážku §13.6(b).",
      "ruleId": "guide-expansion.editorial-review",
      "ruleVersion": "2026-09-09.10"
    },
    {
      "field": "restrictions",
      "sourceId": "spdx-license-list",
      "locator": "APSL 1.0 §2.1(b)/6 omezuje další podmínky, §8 vylučuje záruky, §9.2 odpovědnost s limitem 50 USD, §10 známky, §12.1(c) má patentovou odvetu. Unknown zachovává širší Apple práva/výjimku §3(b)/11, uživatelské exportní prohlášení §13.1 a stavové ukončení/ničení; nejde o chybějící četbu.",
      "ruleId": "guide-expansion.editorial-review",
      "ruleVersion": "2026-09-09.10"
    },
    {
      "field": "patentPosition",
      "sourceId": "spdx-license-list",
      "locator": "APSL 1.0 §§1.1,2,3,5 poskytují výslovně omezené granty pro Original Code a změny, s oddělením dalších patentů pro Larger Work. §12.1(c) jakákoli žaloba za porušení patentu proti Apple automaticky ukončí celou licenci bez vazby jen na Covered Code: retaliatory-termination, nikoli pouhé mlčení či absolutní výluka.",
      "ruleId": "guide-expansion.editorial-review",
      "ruleVersion": "2026-09-09.10"
    },
    {
      "field": "noticeBurden",
      "sourceId": "spdx-license-list",
      "locator": "APSL 1.0 §§2.1(a)–(c),2.2(c)–(d) a Exhibit A požadují řadu oznámení, podrobný datovaný změnový soubor, hlášení a zdrojovou informaci v kódu i dokumentaci. Materiální zátěž s přesnou rolí jednotlivých kroků, nikoli reklamní poděkování.",
      "ruleId": "guide-expansion.editorial-review",
      "ruleVersion": "2026-09-09.10"
    },
    {
      "field": "review",
      "sourceId": "spdx-license-list",
      "locator": "Dne 2026-09-10 samostatně přečteno úplné připnuté APSL 1.0 z 16.3.1999 včetně všech §§1–13 a Exhibit A; primární SPDX stránka potvrzuje identitu a dotčené mechanismy. §9.1 je okamžité webové ukončení, §2.2(c) bez availability výjimky, §12.2 širší ničení kopií. Konkrétní nevyjádřené povinnosti brání zařazení; kanonický zdroj a otisk zůstaly zachovány.",
      "ruleId": "guide-expansion.editorial-review",
      "ruleVersion": "2026-09-09.10"
    }
  ]
}
