{
  "id": "MS-PL",
  "kind": "license",
  "schemaVersion": "1.0.0",
  "sourceFingerprint": {
    "sourceId": "spdx-license-list",
    "revision": "manifest-sha256:74897699de0d23c4da42b94bf46bc6fd01f7b68ffcece9db1a98194ac277bb02",
    "contentHash": "sha256:671272da3c162361c9a92f9f4f3af1dd2462c8f6caa9f6629d61f68cd2b5cb25"
  },
  "review": {
    "status": "not-recommendable",
    "recommendable": false,
    "evidenceLevel": "strong"
  },
  "semantic": {
    "family": "unknown",
    "copyleftScope": "unknown",
    "permissions": [
      "commercial-use",
      "distribution",
      "modifications",
      "patent-grant",
      "private-use"
    ],
    "obligations": [
      "include-copyright",
      "include-license-text",
      "include-notice",
      "same-license"
    ],
    "triggers": [
      "distribution",
      "modification",
      "patent-claim"
    ],
    "restrictions": [
      "patent-claim",
      "trademark",
      "warranty"
    ],
    "patentPosition": "defensive-termination",
    "noticeBurden": "standard"
  },
  "evidence": [
    {
      "field": "copyleftScope",
      "sourceId": "spdx-license-list",
      "locator": "public/data/licenses/MS-PL.json#text; section 3(D): conditional source-form license preservation with no duty to supply source; unknown until source-vs-object model is added; https://spdx.org/licenses/MS-PL.html",
      "ruleId": "guide-expansion.editorial-review",
      "ruleVersion": "2026-09-09.2"
    },
    {
      "field": "family",
      "sourceId": "spdx-license-list",
      "locator": "public/data/licenses/MS-PL.json#text; section 3(D): same-license condition for distributed source but compiled/object distribution need only compliant terms; current family/scope pairing cannot distinguish this from reciprocal source-disclosure; https://spdx.org/licenses/MS-PL.html",
      "ruleId": "guide-expansion.editorial-review",
      "ruleVersion": "2026-09-09.2"
    },
    {
      "field": "noticeBurden",
      "sourceId": "spdx-license-list",
      "locator": "public/data/licenses/MS-PL.json#text; sections 3(C)-(D): retain notices, complete license copy required for source form; https://spdx.org/licenses/MS-PL.html",
      "ruleId": "guide-expansion.editorial-review",
      "ruleVersion": "2026-09-09.2"
    },
    {
      "field": "obligations",
      "sourceId": "spdx-license-list",
      "locator": "public/data/licenses/MS-PL.json#text; sections 3(C)-(D): keep copyright/patent/trademark/attribution; same license and complete copy IF distributed as source; object/binary under compliant license, NO source-supply duty; https://spdx.org/licenses/MS-PL.html",
      "ruleId": "guide-expansion.editorial-review",
      "ruleVersion": "2026-09-09.2"
    },
    {
      "field": "patentPosition",
      "sourceId": "spdx-license-list",
      "locator": "public/data/licenses/MS-PL.json#text; sections 1,2(B),3(B): scoped express patent grant; claim against contributor ends patent license from that contributor only; https://spdx.org/licenses/MS-PL.html",
      "ruleId": "guide-expansion.editorial-review",
      "ruleVersion": "2026-09-09.2"
    },
    {
      "field": "permissions",
      "sourceId": "spdx-license-list",
      "locator": "public/data/licenses/MS-PL.json#text; sections 2(A)-(B): copyright reproduction/derivatives/distribution and contributor patent rights including commercial exploitation; no general sublicensing grant; https://spdx.org/licenses/MS-PL.html",
      "ruleId": "guide-expansion.editorial-review",
      "ruleVersion": "2026-09-09.2"
    },
    {
      "field": "restrictions",
      "sourceId": "spdx-license-list",
      "locator": "public/data/licenses/MS-PL.json#text; sections 3(A),(B),(E): no name/logo/trademark rights, patent rights from sued contributor end, warranty disclaimer preserves local consumer rights; no explicit liability exclusion; https://spdx.org/licenses/MS-PL.html",
      "ruleId": "guide-expansion.editorial-review",
      "ruleVersion": "2026-09-09.2"
    },
    {
      "field": "review",
      "sourceId": "spdx-license-list",
      "locator": "public/data/licenses/MS-PL.json#text; whole-text editorial review on 2026-09-09, batch 2; Nezařazena: § 3(D) vyžaduje stejnou licenci pro distribuované zdroje, ale neukládá zdroje poskytovat při binární distribuci. Opraven falešný požadavek na odpovídající zdroje. Doplnit podmínění povinností formou distribuce a vhodnou klasifikaci bez záměny s MS-RL; patentový grant a jeho ukončení jsou již doloženy.; https://spdx.org/licenses/MS-PL.html",
      "ruleId": "guide-expansion.editorial-review",
      "ruleVersion": "2026-09-09.2"
    },
    {
      "field": "triggers",
      "sourceId": "spdx-license-list",
      "locator": "public/data/licenses/MS-PL.json#text; sections 3(B)-(D): patent claim and distribution of original/modified software; same-license obligation conditional on distribution form; https://spdx.org/licenses/MS-PL.html",
      "ruleId": "guide-expansion.editorial-review",
      "ruleVersion": "2026-09-09.2"
    }
  ]
}
